{
  "schema_version": 1,
  "public_surfaces": [
    {
      "path": "README.md",
      "category": "root-docs",
      "marker_required": true
    },
    {
      "path": "ARCHITECTURE.md",
      "category": "root-docs",
      "marker_required": true
    },
    {
      "path": "docs/README.md",
      "category": "product-docs",
      "marker_required": true
    },
    {
      "path": "docs/api.md",
      "category": "product-docs",
      "marker_required": true
    },
    {
      "path": "docs/architecture.md",
      "category": "product-docs",
      "marker_required": true
    },
    {
      "path": "docs/dashboard-streaming.md",
      "category": "product-docs",
      "marker_required": true
    },
    {
      "path": "docs/development.md",
      "category": "product-docs",
      "marker_required": true
    },
    {
      "path": "docs/helm-values.md",
      "category": "product-docs",
      "marker_required": true
    },
    {
      "path": "docs/installation.md",
      "category": "product-docs",
      "marker_required": true
    },
    {
      "path": "docs/local-kubernetes-runner.md",
      "category": "product-docs",
      "marker_required": true
    },
    {
      "path": "docs/minikube-smoke.md",
      "category": "product-docs",
      "marker_required": true
    },
    {
      "path": "docs/operations.md",
      "category": "operations",
      "marker_required": true
    },
    {
      "path": "docs/operations/backup-restore-dr.md",
      "category": "operations",
      "marker_required": true
    },
    {
      "path": "docs/operations/observability.md",
      "category": "operations",
      "marker_required": true
    },
    {
      "path": "docs/persistence.md",
      "category": "product-docs",
      "marker_required": true
    },
    {
      "path": "docs/security.md",
      "category": "security",
      "marker_required": true
    },
    {
      "path": "docs/security/secrets-rotation.md",
      "category": "security",
      "marker_required": true
    },
    {
      "path": "docs/troubleshooting.md",
      "category": "operations",
      "marker_required": true
    },
    {
      "path": "docs/worker-runner.md",
      "category": "product-docs",
      "marker_required": true
    },
    {
      "path": "sdk/python/README.md",
      "category": "sdk",
      "marker_required": true
    },
    {
      "path": "sdk/python/pyproject.toml",
      "category": "sdk",
      "marker_required": true
    },
    {
      "path": "dashboard/README.md",
      "category": "dashboard",
      "marker_required": true
    },
    {
      "path": "dashboard/package.json",
      "category": "dashboard",
      "marker_required": true
    },
    {
      "path": "dashboard/app/artifacts/page.tsx",
      "category": "dashboard",
      "marker_required": true
    },
    {
      "path": "dashboard/app/automations/page.tsx",
      "category": "dashboard",
      "marker_required": true
    },
    {
      "path": "dashboard/app/components.tsx",
      "category": "dashboard",
      "marker_required": true
    },
    {
      "path": "dashboard/app/execution-pools/page.tsx",
      "category": "dashboard",
      "marker_required": true
    },
    {
      "path": "dashboard/app/job-definitions/page.tsx",
      "category": "dashboard",
      "marker_required": true
    },
    {
      "path": "dashboard/app/layout.tsx",
      "category": "dashboard",
      "marker_required": true
    },
    {
      "path": "dashboard/app/login/page.tsx",
      "category": "dashboard",
      "marker_required": true
    },
    {
      "path": "dashboard/app/logs/page.tsx",
      "category": "dashboard",
      "marker_required": true
    },
    {
      "path": "dashboard/app/memory/layout.tsx",
      "category": "dashboard",
      "marker_required": true
    },
    {
      "path": "dashboard/app/memory/memory-ui.tsx",
      "category": "dashboard",
      "marker_required": true
    },
    {
      "path": "dashboard/app/memory/page.tsx",
      "category": "dashboard",
      "marker_required": true
    },
    {
      "path": "dashboard/app/memory/contracts/page.tsx",
      "category": "dashboard",
      "marker_required": true
    },
    {
      "path": "dashboard/app/memory/edges/page.tsx",
      "category": "dashboard",
      "marker_required": true
    },
    {
      "path": "dashboard/app/memory/entities/page.tsx",
      "category": "dashboard",
      "marker_required": true
    },
    {
      "path": "dashboard/app/memory/ingestion/page.tsx",
      "category": "dashboard",
      "marker_required": true
    },
    {
      "path": "dashboard/app/memory/subgraphs/page.tsx",
      "category": "dashboard",
      "marker_required": true
    },
    {
      "path": "dashboard/app/memory/traces/page.tsx",
      "category": "dashboard",
      "marker_required": true
    },
    {
      "path": "dashboard/app/page.tsx",
      "category": "dashboard",
      "marker_required": true
    },
    {
      "path": "dashboard/app/runs/[id]/page.tsx",
      "category": "dashboard",
      "marker_required": true
    },
    {
      "path": "dashboard/app/runs/[id]/run-detail-client.tsx",
      "category": "dashboard",
      "marker_required": true
    },
    {
      "path": "dashboard/app/runs/page.tsx",
      "category": "dashboard",
      "marker_required": true
    },
    {
      "path": "dashboard/app/runs/runs-client.tsx",
      "category": "dashboard",
      "marker_required": true
    },
    {
      "path": "dashboard/app/security/page.tsx",
      "category": "dashboard",
      "marker_required": true
    },
    {
      "path": "dashboard/app/settings/page.tsx",
      "category": "dashboard",
      "marker_required": true
    },
    {
      "path": "dashboard/app/trigger-plugins/page.tsx",
      "category": "dashboard",
      "marker_required": true
    },
    {
      "path": "dashboard/app/workflows/new/page.tsx",
      "category": "dashboard",
      "marker_required": true
    },
    {
      "path": "dashboard/app/workflows/page.tsx",
      "category": "dashboard",
      "marker_required": true
    },
    {
      "path": "dashboard/app/mock-data.ts",
      "category": "dashboard",
      "marker_required": true
    },
    {
      "path": "examples/send-email/README.md",
      "category": "example",
      "marker_required": true
    },
    {
      "path": "examples/workflows/README.md",
      "category": "example",
      "marker_required": true
    },
    {
      "path": "charts/capsulet/Chart.yaml",
      "category": "package-metadata",
      "marker_required": true
    },
    {
      "path": "charts/capsulet/values.yaml",
      "category": "package-metadata",
      "marker_required": true
    },
    {
      "path": "charts/capsulet/values.schema.json",
      "category": "package-metadata",
      "marker_required": true
    },
    {
      "path": "crates/api/openapi.json",
      "category": "served-openapi",
      "marker_required": true
    }
  ],
  "test_manifest": [
    {
      "command": "cargo test -p capsulet-kernel --locked",
      "tests": [
        {
          "path": "crates/kernel/src/tests.rs",
          "selector": "accepts_a_citation_that_re_derives_and_states_its_proposition"
        },
        {
          "path": "crates/kernel/tests/depth.rs",
          "selector": "a_derivation_far_past_the_bound_is_still_only_a_rejection"
        },
        {
          "path": "crates/kernel/tests/depth.rs",
          "selector": "the_kernel_does_not_rely_on_the_transport_to_bound_depth"
        },
        {
          "path": "crates/kernel/tests/grounding.rs",
          "selector": "composition_does_not_change_what_a_document_says"
        },
        {
          "path": "crates/kernel/tests/grounding.rs",
          "selector": "an_excerpt_longer_than_the_bound_is_not_a_citation"
        },
        {
          "path": "crates/kernel/tests/interpretation.rs",
          "selector": "a_reading_without_a_rationale_is_refused"
        },
        {
          "path": "crates/kernel/tests/interpretation.rs",
          "selector": "the_residual_names_the_premise_the_conclusion_and_the_evidence"
        },
        {
          "path": "crates/kernel/tests/interpretation.rs",
          "selector": "a_reading_never_reaches_accepted_however_authoritative_the_source"
        },
        {
          "path": "crates/kernel/tests/arithmetic.rs",
          "selector": "the_classic_float_sum_is_exact_here"
        },
        {
          "path": "crates/kernel/tests/arithmetic.rs",
          "selector": "neighbouring_values_are_distinguished_at_any_magnitude"
        },
        {
          "path": "crates/kernel/tests/arithmetic.rs",
          "selector": "a_result_that_would_not_be_exact_is_refused_rather_than_rounded"
        },
        {
          "path": "crates/kernel/tests/replay.rs",
          "selector": "a_bundle_with_nothing_in_it_says_so_rather_than_reproducing_quietly"
        },
        {
          "path": "crates/kernel/tests/replay.rs",
          "selector": "inputs_that_are_present_and_unreadable_are_not_reported_as_missing"
        },
        {
          "path": "crates/kernel/tests/replay.rs",
          "selector": "a_proposal_from_an_unknown_major_is_unreadable_not_malformed"
        },
        {
          "path": "crates/kernel/tests/replay.rs",
          "selector": "a_proposal_always_serializes_its_schema_version"
        },
        {
          "path": "crates/kernel/tests/replay.rs",
          "selector": "a_versionless_proposal_reads_as_v1_and_replays"
        },
        {
          "path": "crates/kernel/tests/replay.rs",
          "selector": "a_proposals_schema_is_checked_before_its_shape"
        },
        {
          "path": "crates/kernel/tests/replay.rs",
          "selector": "a_malformed_v1_proposal_is_not_an_unknown_schema"
        },
        {
          "path": "crates/kernel/tests/totality.rs",
          "selector": "every_derivation_shape_reaches_a_verdict"
        },
        {
          "path": "crates/kernel/tests/known_gaps.rs",